[
  {
    "consultation_id": "c79cabb3-37c8-5e1e-8cb3-b656a45e222a",
    "consultation_number": "CON-SYN-0002-1",
    "inquiry_id": "bcb70ef6-01ac-5e0e-8a8d-fe5af43e8bde",
    "sequence": 1,
    "counselor_id": "9791249c-4e86-539c-8c50-b8d02c3fc57f",
    "status": "COMPLETED",
    "outcome": "VISIT_REQUIRED",
    "summary": "출수량 저하 대표 E2E 합성 상담 기록",
    "state_version": 1,
    "idempotency_key": "idem-consultation-002-1",
    "correlation_id": "e5a21d79-f423-5795-aae1-10a5ba772937",
    "created_at": "2026-07-01T23:00:00+09:00",
    "started_at": "2026-07-01T23:30:00+09:00",
    "completed_at": "2026-07-02T00:00:00+09:00",
    "data_classification": "synthetic"
  },
  {
    "consultation_id": "f68af67b-e066-5fa3-abcc-a01150a19b0c",
    "consultation_number": "CON-SYN-0004-1",
    "inquiry_id": "8e2e2561-613b-5911-9318-b651f0787a90",
    "sequence": 1,
    "counselor_id": null,
    "status": "WAITING",
    "outcome": "PENDING",
    "summary": "제품 아래 물 고임 합성 상담 기록",
    "state_version": 1,
    "idempotency_key": "idem-consultation-004-1",
    "correlation_id": "8d8f04b3-08a1-5d20-8ab1-4e5dd2545e10",
    "created_at": "2026-07-02T10:00:00+09:00",
    "started_at": null,
    "completed_at": null,
    "data_classification": "synthetic"
  },
  {
    "consultation_id": "946c368f-4b15-5d16-a401-de812e093c0c",
    "consultation_number": "CON-SYN-0006-1",
    "inquiry_id": "2b7d96e6-25a1-52eb-a8e2-9e52caf68b60",
    "sequence": 1,
    "counselor_id": null,
    "status": "WAITING",
    "outcome": "PENDING",
    "summary": "순간온수 모듈 점검 표시 합성 상담 기록",
    "state_version": 1,
    "idempotency_key": "idem-consultation-006-1",
    "correlation_id": "b9f59d18-3065-5e3b-8e5c-859008b16ba6",
    "created_at": "2026-07-02T22:00:00+09:00",
    "started_at": null,
    "completed_at": null,
    "data_classification": "synthetic"
  },
  {
    "consultation_id": "70568e17-8d7c-5585-9b0b-db47aa51f43e",
    "consultation_number": "CON-SYN-0008-1",
    "inquiry_id": "a6bdf6b7-b9ba-553a-8447-f928384c1ad1",
    "sequence": 1,
    "counselor_id": "626a015c-51d2-53cd-b2c2-1cfbd85d1027",
    "status": "COMPLETED",
    "outcome": "VISIT_REQUIRED",
    "summary": "필터 교체 후에도 지속되는 무출수 합성 상담 기록",
    "state_version": 1,
    "idempotency_key": "idem-consultation-008-1",
    "correlation_id": "d9c5de5d-7b45-5893-a1f3-eff31a160642",
    "created_at": "2026-07-03T10:30:00+09:00",
    "started_at": "2026-07-03T11:00:00+09:00",
    "completed_at": "2026-07-03T11:30:00+09:00",
    "data_classification": "synthetic"
  },
  {
    "consultation_id": "3d957e75-b1d9-5aed-95f8-55cbe7d98b32",
    "consultation_number": "CON-SYN-0012-1",
    "inquiry_id": "46b60ae4-9ea0-5dea-b414-f9eda839056d",
    "sequence": 1,
    "counselor_id": "626a015c-51d2-53cd-b2c2-1cfbd85d1027",
    "status": "COMPLETED",
    "outcome": "COMPLETED_NO_VISIT",
    "summary": "처리 후 재발한 냉수 이상 합성 상담 기록",
    "state_version": 1,
    "idempotency_key": "idem-consultation-012-1",
    "correlation_id": "b5a2af15-a2ef-5d32-ac86-c35fe0325e90",
    "created_at": "2026-07-04T10:30:00+09:00",
    "started_at": "2026-07-04T11:00:00+09:00",
    "completed_at": "2026-07-04T11:30:00+09:00",
    "data_classification": "synthetic"
  },
  {
    "consultation_id": "88d68b14-63bf-55bb-b155-0fc8d372aeb3",
    "consultation_number": "CON-SYN-0012-2",
    "inquiry_id": "46b60ae4-9ea0-5dea-b414-f9eda839056d",
    "sequence": 2,
    "counselor_id": null,
    "status": "WAITING",
    "outcome": "REOPENED_FOLLOWUP",
    "summary": "처리 후 재발한 냉수 이상 재오픈 합성 상담 기록",
    "state_version": 1,
    "idempotency_key": "idem-consultation-012-2",
    "correlation_id": "b5a2af15-a2ef-5d32-ac86-c35fe0325e90",
    "created_at": "2026-07-04T12:30:00+09:00",
    "started_at": null,
    "completed_at": null,
    "data_classification": "synthetic"
  },
  {
    "consultation_id": "895047e5-dbae-59b9-982c-3e67f50da696",
    "consultation_number": "CON-SYN-0013-1",
    "inquiry_id": "205850d3-763c-5256-9d39-82da21be0c31",
    "sequence": 1,
    "counselor_id": "626a015c-51d2-53cd-b2c2-1cfbd85d1027",
    "status": "IN_PROGRESS",
    "outcome": "PENDING",
    "summary": "연결부의 지속적인 물방울 합성 상담 기록",
    "state_version": 1,
    "idempotency_key": "idem-consultation-013-1",
    "correlation_id": "c4b05213-cd3b-5e37-a21a-40407963494f",
    "created_at": "2026-07-04T16:00:00+09:00",
    "started_at": "2026-07-04T16:30:00+09:00",
    "completed_at": null,
    "data_classification": "synthetic"
  },
  {
    "consultation_id": "27b55937-26c1-51b2-918a-598952d7d0b6",
    "consultation_number": "CON-SYN-0014-1",
    "inquiry_id": "60d83c53-efc8-5467-a13b-0f45f9ea9177",
    "sequence": 1,
    "counselor_id": "9791249c-4e86-539c-8c50-b8d02c3fc57f",
    "status": "COMPLETED",
    "outcome": "VISIT_REQUIRED",
    "summary": "안전조치 후 재발하는 누수 합성 상담 기록",
    "state_version": 1,
    "idempotency_key": "idem-consultation-014-1",
    "correlation_id": "6485e221-0f76-54ca-84ce-1da93c81a4bb",
    "created_at": "2026-07-04T22:00:00+09:00",
    "started_at": "2026-07-04T22:30:00+09:00",
    "completed_at": "2026-07-04T23:00:00+09:00",
    "data_classification": "synthetic"
  },
  {
    "consultation_id": "ad43414e-7c13-52b6-a269-1222531a1672",
    "consultation_number": "CON-SYN-0016-1",
    "inquiry_id": "596a3d42-4301-5bd9-a561-dca39150fe24",
    "sequence": 1,
    "counselor_id": "626a015c-51d2-53cd-b2c2-1cfbd85d1027",
    "status": "COMPLETED",
    "outcome": "COMPLETED_NO_VISIT",
    "summary": "점검 후에도 재발한 맛 이상 합성 상담 기록",
    "state_version": 1,
    "idempotency_key": "idem-consultation-016-1",
    "correlation_id": "823ba8ce-fe16-5e04-b4b6-41737a6c1e17",
    "created_at": "2026-07-05T10:30:00+09:00",
    "started_at": "2026-07-05T11:00:00+09:00",
    "completed_at": "2026-07-05T11:30:00+09:00",
    "data_classification": "synthetic"
  },
  {
    "consultation_id": "8aab21d6-a2fe-5a92-ae57-f6c5cfd61995",
    "consultation_number": "CON-SYN-0016-2",
    "inquiry_id": "596a3d42-4301-5bd9-a561-dca39150fe24",
    "sequence": 2,
    "counselor_id": "626a015c-51d2-53cd-b2c2-1cfbd85d1027",
    "status": "IN_PROGRESS",
    "outcome": "REOPENED_FOLLOWUP",
    "summary": "점검 후에도 재발한 맛 이상 재오픈 합성 상담 기록",
    "state_version": 1,
    "idempotency_key": "idem-consultation-016-2",
    "correlation_id": "823ba8ce-fe16-5e04-b4b6-41737a6c1e17",
    "created_at": "2026-07-05T12:30:00+09:00",
    "started_at": "2026-07-05T13:00:00+09:00",
    "completed_at": null,
    "data_classification": "synthetic"
  },
  {
    "consultation_id": "a531281b-2561-57b2-bf04-a42f21356a62",
    "consultation_number": "CON-SYN-0017-1",
    "inquiry_id": "be4c7a29-fa4f-5e8f-bb9e-1dab0badf146",
    "sequence": 1,
    "counselor_id": "626a015c-51d2-53cd-b2c2-1cfbd85d1027",
    "status": "COMPLETED",
    "outcome": "COMPLETED_NO_VISIT",
    "summary": "계속되는 온수 스팀 합성 상담 기록",
    "state_version": 1,
    "idempotency_key": "idem-consultation-017-1",
    "correlation_id": "bab06bf5-7af5-5f6f-88e1-bcd2bd3b070e",
    "created_at": "2026-07-05T16:00:00+09:00",
    "started_at": "2026-07-05T16:30:00+09:00",
    "completed_at": "2026-07-05T17:00:00+09:00",
    "data_classification": "synthetic"
  },
  {
    "consultation_id": "39fb113e-4a37-5f06-9203-3b682f4e3d7f",
    "consultation_number": "CON-SYN-0018-1",
    "inquiry_id": "cd9adf11-fd61-57fd-956a-6dfac43fcb3d",
    "sequence": 1,
    "counselor_id": "9791249c-4e86-539c-8c50-b8d02c3fc57f",
    "status": "COMPLETED",
    "outcome": "VISIT_REQUIRED",
    "summary": "재연결 후에도 온수 불량 합성 상담 기록",
    "state_version": 1,
    "idempotency_key": "idem-consultation-018-1",
    "correlation_id": "7d61749d-e291-543f-af63-837f088fd3d7",
    "created_at": "2026-07-05T22:00:00+09:00",
    "started_at": "2026-07-05T22:30:00+09:00",
    "completed_at": "2026-07-05T23:00:00+09:00",
    "data_classification": "synthetic"
  },
  {
    "consultation_id": "1a2078a2-be48-5168-8959-cecc8361aa1a",
    "consultation_number": "CON-SYN-0021-1",
    "inquiry_id": "d8155085-e77d-5a61-a6e3-57a7d584487a",
    "sequence": 1,
    "counselor_id": "626a015c-51d2-53cd-b2c2-1cfbd85d1027",
    "status": "COMPLETED",
    "outcome": "VISIT_REQUIRED",
    "summary": "지속되는 큰 소음 합성 상담 기록",
    "state_version": 1,
    "idempotency_key": "idem-consultation-021-1",
    "correlation_id": "33cbb0d7-41ec-538d-8698-c6ab0bd6ee3e",
    "created_at": "2026-07-06T16:30:00+09:00",
    "started_at": "2026-07-06T17:00:00+09:00",
    "completed_at": "2026-07-06T17:30:00+09:00",
    "data_classification": "synthetic"
  },
  {
    "consultation_id": "782a5ce9-1ef8-522a-93d3-a7fdf87590f2",
    "consultation_number": "CON-SYN-0022-1",
    "inquiry_id": "dcf13b8e-e15f-5fc3-b194-0a3af2f54985",
    "sequence": 1,
    "counselor_id": null,
    "status": "WAITING",
    "outcome": "PENDING",
    "summary": "앱 필터 상태 조회 문의 합성 상담 기록",
    "state_version": 1,
    "idempotency_key": "idem-consultation-022-1",
    "correlation_id": "87f1e6ed-2000-58c8-a3aa-e71ae7998ed3",
    "created_at": "2026-07-06T22:00:00+09:00",
    "started_at": null,
    "completed_at": null,
    "data_classification": "synthetic"
  },
  {
    "consultation_id": "9d04633a-90e1-510e-a1f6-7358d2217865",
    "consultation_number": "CON-SYN-0023-1",
    "inquiry_id": "2159fcea-b772-5bad-b6f3-6bfe444fb067",
    "sequence": 1,
    "counselor_id": "626a015c-51d2-53cd-b2c2-1cfbd85d1027",
    "status": "IN_PROGRESS",
    "outcome": "PENDING",
    "summary": "와이파이 연결 문의 합성 상담 기록",
    "state_version": 1,
    "idempotency_key": "idem-consultation-023-1",
    "correlation_id": "493826d3-b66b-5ac6-a5a1-840c00506b4b",
    "created_at": "2026-07-07T04:00:00+09:00",
    "started_at": "2026-07-07T04:30:00+09:00",
    "completed_at": null,
    "data_classification": "synthetic"
  },
  {
    "consultation_id": "5256a248-7d2f-5867-a7de-ee85a455bcf0",
    "consultation_number": "CON-SYN-0024-1",
    "inquiry_id": "c99ad03e-b625-5669-86c8-e37f121bd6a2",
    "sequence": 1,
    "counselor_id": null,
    "status": "WAITING",
    "outcome": "PENDING",